school_name,url_address,address,postal_code,telephone_no,telephone_no_2,fax_no,fax_no_2,email_address,mrt_desc,bus_desc,principal_name,first_vp_name,second_vp_name,third_vp_name,fourth_vp_name,fifth_vp_name,sixth_vp_name,visionstatement_desc,missionstatement_desc,philosophy_culture_ethos,dgp_code,zone_code,cluster_code,type_code,nature_code,session_code,mainlevel_code,sap_ind,autonomous_ind,gifted_ind,ip_ind,mothertongue1_code,mothertongue2_code,mothertongue3_code,special_sdp_offered,grade_A,grade_O
JURONG PRIMARY SCHOOL,http://www.jurongpri.moe.edu.sg,320 JURONG EAST STREET 32,609476,65618837,na,65641964,na,JPS@MOE.EDU.SG,Lakeside MRT Station_ Jurong East MRT Station,333,MR ONG THIAM HUAT ROBIN,MDM CHERYL CHOO SHUEH-LI,MDM LEE HWEE KHENG,na,na,na,na,A vibrant community of gracious citizens and passionate learners,We nurture all-rounded pupils of grace_ distinction and sound moral values_ready to take on future endeavours.,With a strong conviction that children are small but their minds are not_ Jurong Primary School (JPS) provides a holistic education to our students through a variety of quality programmes. Every JPS student is a leader who demonstrates the 7 habits of The Leader in Me when leading self_ peer and school.  Through platforms like the Every Child Leads in Instrumental Performance (ECLIP) programme as well as the Integrated Project Work (IPW)_ JPS students are empowered with leadership competencies to become gracious leaders and passionate learners.  Every JPS teacher is a nurturing educator committed to building a culture of care and excellence in the school.   Leveraging on strategic partnerships with our stakeholders_ we will develop all-rounded students of distinction ready to take on future endeavours.,JURONG EAST,WEST,WEST 4,GOVERNMENT SCHOOL,CO-ED SCHOOL,SINGLE SESSION,PRIMARY,No,No,No,No,Chinese,Malay,Tamil,JPS is committed to giving each child a broad and deep foundation for a lifelong journey of learning.  Holistic education is about nurturing the whole child_ developing in our children an enduring core of skills_ dispositions and competencies_ steeped in values and character_ to enable them to thrive in the future workplace_ and more importantly_ lead purposeful and meaningful lives.  JPS has been awarded the Learning for Life Programme (LLP) status in Music and Performing Arts with our special programme known as the ECLIP (Every Child Leads in Instrumental Performance).  Through  this programme_ not only will the students learn to appreciate_ create and love music_ but also develop in them other competencies and values in life.   Through music_ we strive also to build in all our students leadership competencies.  To this end_ we have embarked on a programme called Leader In Me programme which utilizes the 7 Habits of Highly Effective People.  Our overseas immersion programes also help our students to sensitize them to the world around them.,-1,-1
KENT RIDGE SECONDARY SCHOOL,http://www.kentridgesec.moe.edu.sg,147 WEST COAST ROAD,127368,67731127,na,67735119,na,KRSS@MOE.EDU.SG,CLEMENTI MRT_ HAW PAR VILLA MRT,30_ 51_ 143_ 175_ 176_ 201_ 282,MR KEH CHIN CHUAN BENEDICT,MISS WEE MEI YEN JANICE,MR QUAH SIEW KIN,na,na,na,na,A Kent Ridgean has the Heart of a Saint_ the Passion of an Inventor_ and the Will of an Olympian.,Kent Ridge Secondary nurtures the heart_ ignites the passion and strengthens the will of all Kent Ridgeans to become individuals of exemplary character.,The hallmark of an education at Kent Ridge is the culture of care and excellence. Guided by our philosophy that 'Every Student Counts'_ our passionate and dedicated staff place our students at the centre of all that we do and spare no effort to instil the right values in them. This commitment to excellence has been recognised at the national level by the awarding of the President's Award for Teachers in 2013_ the nation's highest award for teachers and the Caring Teacher Award in 2010. Our holistic curriculum has also been recognised by the awarding of the Best Practice (Student All Round Development) in 2015. Kent Ridge is proud of what we have achieved in nurturing our students to be exemplary individuals who have the Heart of a Saint_ Passion of an Inventor and Will of an Olympian. We look forward to scaling greater heights as we continue to go 'Beyond Frontiers'. Kent Ridge offers many opportunities for our students to learn and grow through our rich array of programmes such as the Experiential Week_ KR Hands-On Day (School VIA)_ Entrepreneurship Fair_ Project Work_ the Arts Programme_ Inter-class games_ Speak Up_ Speak Out_ Speak Right Oracy Programme_ Shanghai Twinning Programme_ Hong Kong Immersion Programme_ Overseas Learning Journeys_ Sports Electives_ Applied Learning Programme in Robotics and Learning for Life Programme in Sports and Outdoor Education.,CLEMENTI,SOUTH,SOUTH 2,GOVERNMENT SCHOOL,CO-ED SCHOOL,SINGLE SESSION,SECONDARY,No,No,No,No,Chinese,Malay,na,At Kent Ridge_ we are committed to providing a holistic education for all our students anchored on our school values of Fitness of Mind and Body; Integrity in Word and Deed; Respect for Self_ Community and Environment and Excellence in All Our Endeavours. Students will have opportunities to take part in key programmes including: Character and Citizenship Education with a focus on personal and social life-skills; Learning for Life Programme (Sports and Outdoor Education); Applied Learning Programme (Robotics); Values-in-Action Programme; National Education; Student Leadership Development; Elective Modules; Advanced Elective Modules; Career Guidance; Internationalisation Programme; Subject-based Enrichment Modules; Family Matters! programmes; After School Engagement programmes.,-1,214
LIANHUA PRIMARY SCHOOL,http://www.lianhuapri.moe.edu.sg/,2 BUKIT BATOK STREET 52,659243,65639502,na,65639591,na,lianhua_ps@moe.edu.sg,Bukit Gombak/Bukit Batok,945,MR WILLY TAN NGUAN PENG,MISS TAN HUI PING,MR ANDY ANG,na,na,na,na,Hearts of Service_ Minds of Inquiry_ Joy in Learning_ Confidence in Life,Together_ we bring out the best in every child for a better nation,In Lianhua_ we believe that school should not just be about academic excellence. To better prepare our students for a future that is more dynamic and complex_ we must focus on the all-round development of students_ and equip them with the skills_ attitudes and values to be future-ready - Students who will grow into confident citizens who chart their own paths and create their own successes.  Our school vision is Hearts of Service_ Minds of Inquiry_ Joy in Learning_ Confidence in Life.  Through 'Hearts of Service'_ we want to nurture our students to be caring and compassionate towards others_ to know that regardless of their circumstance_ they can do their part to make a difference to the people around them.  'Minds of Inquiry' is about seeking knowledge and learning to think creatively and critically which is an important 21st century competency. We want our students to be curious about the world and things around them. Learning is no longer something that just takes place in school. During this time_ where change is happening so rapidly_ our hope is for our students to find 'Joy in Learning' and to continue to learn throughout life.  We want out students to grow up to be useful and contributing citizens who are confident and have a strong belief in their self-worth. Thus_ 'Confidence in Life'.  Our school mission is Together we bring out the best in every child for a better nation.  Together is important as it is our belief that the school cannot do it alone. We must establish strong partnerships with Parents and the Community to bring up every child together. Every child is unique with their own interests_ talents and aspirations_ and we want to bring out the best in every child_ to guide and nurture them to their fullest potential. Our PISA (Physical_ Intellectual_ Social-moral & Aesthetics) framework guides us to create all-round quality school experiences for our students and to nurture their talents in their pursuit of being the best they can be.,BUKIT BATOK,WEST,WEST 4,GOVERNMENT SCHOOL,CO-ED SCHOOL,SINGLE SESSION,PRIMARY,No,No,No,No,Chinese,Malay,Tamil,Our LLP_ Values in Action through Sports aims to nurture students into engaged learners who adopt a healthy lifestyle and develop joy in learning; contributing team players who contribute by serving others and promoting teamwork; and confident leaders who display self-confidence and leadership. Through Sports_ experiences are created for students to put our school values into action. For students who excelled_ their passion and skills are honed in our Sports Talent Management Programme. Our ALP_ RITE@Lianhua (Robotics_Info-Technology Education) takes an integrated approach for students to learn 21CC skills in Critical and Inventive Thinking_ Info-tech Literacy and Communication. Through RITE_ students experience and develop their interest and aptitude for Coding and Robotics. Our school is piloting the National Junior Coding Standards to accredit students' coding skills to provide them with insights on their progression. We believe that 'Every Student Can Lead' and thus provide opportunities for every student to become an Empowered Leader who lives out our school vision 'Hearts of Service'. In-house training is conducted to equip students with the skills to lead self and others in service to the school and to the community. A signature programme in the Aesthetics domain in our Young Composers Programme. Students are guided to compose songs about values and friendship that shape the Lianhua identity. It also complements our efforts to create a singing culture in our school as we believe that singing is a natural_ creative and powerful way to engage students in learning about values and life. The Young Explorer Scientist (YES!) Programme shows our strong emphasis on engaging students to appreciate and be excited about nature. With our vast resource of gardens_ animal enclosures and ponds in the school_ students learn Science in an authentic and fun way_ being up close with nature. Also weaved into the curriculum are our fish breeding and indoor hydroponics programmes.,-1,-1
MARYMOUNT CONVENT SCHOOL,HTTP://WWW.MARYMOUNTCONVENT.MOE.EDU.SG,20 MARYMOUNT ROAD,297754,6256 6701,62566532,62543080,na,MMCS@MOE.EDU.SG,Braddell MRT Station or  Caldecott MRT Station,141_ 235,MRS ALLISON LIM,MDM LYNETTE FERNANDEZ,MDM LEE SWEE MEI CHERYL,na,na,na,na,Ladies of compassion_ eloquence and intellect with GOD as our shepherd,We are committed to reaching out with compassion and respect and empowering each person to develop her full potential holistically.,"At Marymount_ we take direction from our foundress_ St Mary Euphrasia_ whom we acknowledge as one of the earliest proponents of student-centricity when she espoused that ""One Person is of More Value than the Whole World"".   As a school_ we put the child at the centre of all we do as we strive to cater to the needs of our pupils and develop them holistically. We offer a rigorous academic curriculum that is complemented by a comprehensive and values-driven co-curricular programme. Taken collectively_ both aim to equip our pupils with the necessary skills_ attributes and 21st century competencies to not only survive but thrive when they leave school.",TOA PAYOH,SOUTH,SOUTH 3,GOVERNMENT-AIDED SCH,GIRLS' SCHOOL,SINGLE SESSION,PRIMARY,No,No,No,No,Chinese,Malay,Tamil,We aim to raise our daughters of Marymount by developing them cognitively_ physically_ socially and morally to be future-ready. Some of our school's signature programmes are outlined below:  Our school's Learning for Life Programme (Sports & Outdoor Education) ia aimed at developing pupils who are healthy in mind_ body and soul. It encompasses a coherent PE curriculum over 6 years that offers Educational Gymnastics for all pupils_ camps and outdoor learning activities such as trekking and water-based activities during the Week for Experiential Learning (WELL)_ as well as ensuring that pupils' interests are catered to and enhancing the capacity of those with identified talents through the various sports CCAs.  Our school's niche in Aesthetics sees a distinctive arts programme_ the STAR programme_ that permeates the whole school community. It plays a critical role in nurturing ladies who are refined and cultured and in developing pupils holistically in the 21st century competencies. An immersive and engaging Art and Music programme within curriculum time_ coupled with Arts LJs (eg Esplanade and Singapore Art Museum) in the school's signature WELL programme_ aesthetics modules in PAL and events such as the Arts Fest and Arts Week_ lend to a coherent 6-year curriculum and a vibrant arts culture and environment in the school.  With the strong focus on values at Marymount_ the school's Character and Citizenship Education (CCE) Programme takes centrestage in the curriculum. The school's Values Education (VE) and Catholic Values Education (CVE) programmes run parallel and focus more on the teaching and inculcation of the 8 school values over 6 years.,-1,-1
MILLENNIA INSTITUTE,http://www.millenniainstitute.moe.edu.sg,60 BUKIT BATOK WEST AVENUE 8,658965,63023700,na,63023767,na,millennia_inst@moe.edu.sg,Bukit Batok (NS-2),66_ 157_ 174_ 174E_ 506 _ 178_ 941_ 174M - Night,MRS TAN WAN YU,MS TNG YA WEN VALERIE,MR CHIA GUO HAO,MR DAVID ALLAN D'SOUZA,na,na,na,A Forward-looking Community of Learners_ Thinkers and Leaders,Nurturing Talents to Achieve Success. The MI mission is to nurture our students to be grounded on the core values of INTEGRITY_ RESILIENCE_ RESPECT and RESPONSIBILITY_ so that they succeed as contributing members of society.  This is done_ in partnership with our stakeholders_ by providing a variety of programmes and opportunities to students to have a broad-based learning experience and space to pursue their passion and interests.,na,BUKIT BATOK,WEST,WEST 7,GOVERNMENT SCHOOL,CO-ED SCHOOL,FULL DAY,CENTRALISED INSTITUTE,No,No,No,No,Chinese,Malay,Tamil,MI.World_ SkillsFuture_ Gap Week_ Design Thinking and I & E motivate and equip students with academic and life skills_ 21C Competencies to be future-ready and creative and inventive thinkers and empower students to plan their own holistic development.,-1,-1
NANYANG JUNIOR COLLEGE,http://www.nanyangjc.moe.edu.sg/,128 SERANGOON AVENUE 3,556111,62842281,na,62855147,na,nyjc@moe.edu.sg,2-minute walk from the Lorong Chuan MRT Station (Circle Line),22_ 24_ 53_ 73_ 133_ 105_ 135_ 136_ 156_ 853,MR LOW CHUN MENG,MISS WU XINPING JENNIFER,MS NG BOON MIN,MR NING TAU YEE,na,na,na,A leading college serving the nation with: - Enhanced character development - Quality staff - Quality learners - Organisational excellence,Uphold Values Enhance Lifeskills Maximise Potential,na,SERANGOON,SOUTH,SOUTH 6,GOVERNMENT-AIDED SCH,CO-ED SCHOOL,FULL DAY,JUNIOR COLLEGE,No,No,No,No,na,na,na,Art Elective Programme (AEP)_ Language Elective Programme (Chinese) (CLEP)_ Student Leadership Development Programme_ Overseas Service-Learning Programme_ Career Guidance Programme_ Scholar Development Programme_ S6 Centre of Excellance for CL and Art,6,-1
NATIONAL JUNIOR COLLEGE,http://www.nationaljc.moe.edu.sg,37 HILLCREST ROAD,288913,64661144,na,64684535,na,NJC@MOE.EDU.SG,BOTANIC GARDENS MRT_ TAN KAH KEE MRT_ SIXTH AVENUE MRT,151_ 154_ 156_ 157_ 170_ 170X_ 171_ 174_ 66_ 67_ 67A_ 67W_ 74_ 852_ 961_ 961C,MR ANG POW CHEW,MR LIONG HUAI YU,MR HARMAN AUGUSTUS JOHLL,MR TAN YONG LIANG,na,na,na,NJCians demonstrate Loyalty with Integrity; Scholarship with Creativity; Leadership with Sensitivity,College of the Nation: Home of Scholars and Leaders who Serve with Honour,We seek to create a joyful and lively learning community for students and staff. Every NJCian will leave with a distinctive and memorable experience. They will learn to serve with honour_ to be loyal to family and Singapore_ to be leaders sensitive to the needs of others_ and to be creative in their approach to solving problems. They would have imbibed the values of civility_ altruism_ resilience and enterprise.,BUKIT TIMAH,SOUTH,SOUTH 3,GOVERNMENT SCHOOL,CO-ED SCHOOL,FULL DAY,MIXED LEVEL,No,No,No,Yes,Chinese,Malay,Tamil,For the Integrated Programme (Junior High)_ we offer Language Arts (English & Literature)_ Chemistry_ Physics_ Biology_ Governance & Society_ Mathematics (both E and A Maths)_ History_ Geography_ Higher Mother Tongue and Mother Tongue for the first 4 years_ as well as Integrated Sciences_ Thinking_ and General Arts Programme (Art and Music) for the first 2 years. Advanced Language Arts_ Advanced Humanities and Man & Ideas are also offered to capable students at JH3 & JH4. The College offers a wide range of special programmes in various domains. They are: SPIRE (Special Programme in Inquiry and Research)_ Research@NJC_ Accelerated Mathematics_ Advanced Sciences_ Art Elective Programme (AEP)_ NJC Music Programme_ Enhanced Boarding Programme_ Leadership_  Values-In-Action_ Guidance Programmes_ Humanities Scholarship Programme_ Sapphire Programme and International Programmes.  Students may also offer a Third Language outside of College. Junior High 1 students undergo a special CCA programme known as CAFE_ where students will attend one Sports or Performing Arts CCA in Term 1 and another in Term 2 before deciding which CCA to join for the rest of the JH (Sec) years. Students may also join any CCA under the Talent Management Scheme.  Note that H1_ H2 and H3 subjects listed are only offered at Senior High (JC years).,7,256
PEICAI SECONDARY SCHOOL,http://www.peicaisec.moe.edu.sg,10 SERANGOON AVENUE 4,556094,62884159,na,62830480,na,peicai_ss@moe.edu.sg,SERANGOON MRT,22_ 24_ 43_ 53_ 70_ 76_ 103_ 109_ 116_ 147_ 156_ 315_ 317_ 853,MR LIM KOK HWA,MDM CHIN YIH MIN,MISS TAN LI PING,MR SHUE PEI YAN,na,na,na,Critical Minds_ Compassionate Hearts,To nurture critical and independent learners with love for self_ family and society,Peicai Secondary (PCSS) develops students to be future ready Peicaians of Character_ imbued with the values of Perseverance_ Respect_ Responsibility_ Integrity_ Discipline and Empathy. PCSS is committed to provide Peicaians with positive and enriching experiences in a conducive and safe learning environment where they are allowed to learn and grow. Our Instructional_ Character and Leadership programmes enrich_ enhance and enable our students in the 3 domains of the Head_ Heart and Hand. Platforms are provided for Peicaians to contribute to the school_ local and global community through student-initiated and teacher-facilitated activities to hone their leadership and 21CC skills_ and to make a difference to themselves and the lives of others.,SERANGOON,SOUTH,SOUTH 6,GOVERNMENT SCHOOL,CO-ED SCHOOL,SINGLE SESSION,SECONDARY,No,No,No,No,Chinese,Malay,Tamil,The school leverages on its Learning for Life Programme (LLP) - Becoming Person for Others; Leadership Through and For the Community - to develop character traits and leadership skills of Peicaians as responsible citizens of the future. Students are empowered to plan and implement charity drives for their financial needy peers_ health-enhancing and well-being programmes for senior citizens and other social leadership activities for the wider community. The second distinctive programme for PCSS_ the Applied Learning Programme (ALP) in Food_ Health and Sports Science aims to expose Peicaians to experiential learning in food processing_ food technology_ fitness_ lifestyle and healthcare. Together with our student leadership framework_ we hope to mould Peicaians of Character who truly live up to the school vision of Critical Minds_ Compassionate Hearts.,-1,189
PUNGGOL GREEN PRIMARY SCHOOL,http://www.punggolgreenpri.moe.edu.sg,98 PUNGGOL WALK,828772,65383011,na,65383210,na,admin_punggolgreen_ps@moe.edu.sg,Punggol MRT Station,na,MDM CHUA LAY TIN,MR GOH CHANG CHUEN,MISS TAN HUILING CHERYL,MDM TAN BETTY,na,na,na,Every PGPS Student_ A Future-Ready Leader,Engaging Learners_ Nurturing Leaders_ Empowering Givers,Our school's emphasis lies beyond academic achievements. We strive to enhance holistic learning and provide a balance between equipping our students with knowledge and developing in them the 21st Century competencies and values that will prepare them as Future-Ready Leaders to thrive in an ever changing future that is uncertain and ambiguous.   In alignment with that vision_ Punggol Green Primary has also adopted the FISH! Philosophy to build a positive and dynamic school culture that enhances teaching and learning. Through the practice of the FISH! Philosophy_ a safe and playful learning environment is created within the school to enhance personal responsibility and internal motivation amongst staff and students.  Based on FISH! principles_ our teachers created four school mascots - Playto_ Attie_ Makena and Beth to personify these principles for our students to encourage and motivate our students to embrace the FISH! Philosophy as their way of life_ the four principles are integrated into various school programmes.  In order to extend this positive culture to our students' homes_ their parents are encouraged to participate in the FISH! Inventory so that they can practise these four simple and yet powerful principles of the FISH! Philosophy with their children at home.,PUNGGOL,EAST,EAST 1,GOVERNMENT SCHOOL,CO-ED SCHOOL,SINGLE SESSION,PRIMARY,No,No,No,No,Chinese,Malay,Tamil,"LLP in Environmental Education - LEAP As our students are the future stewards of our environment that sustains our society and future generations_ they need to understand the issues_ relationships and interactions between natural and human systems. Hence_ our school is currently developing our LLP in Environmental Education - LEAP. The LEAP curriculum intends to heighten students' awareness and knowledge about the environment and develop CCE values through the care and appreciation of nature_ and 21st century competencies.  At the end of 6 years of LEAP curriculum in PGPS_ we aim to develop our students to become environmentally literate citizens.  School And Parent Partnership (SAPP) Parents play a significant role in support of the child's character and citizenship development. Our parents at PGPS contribute actively through the FISH! Inventory on the demonstration of FISH! Philosophy and school values beyond school. Some of the parents also inspired our students through the ""Our Aspiration"" programme where they shared about the knowledge_ skills and values that are vital towards achieving their goals in building their career.   In a child's educational journey_ the partnership between school and home cannot be undermined. At PGPS_ we recognize the need to constantly engage the parents to work in tandem with them to develop the child to his/her maximum potentials. To provide parents with a fuller picture of their child's holistic development_ the school conducts termly tripartite Parent-Teacher-Child Conferences where the students get to demonstrate their learning in various subject areas and share their reflections with their parents and teachers. This allows parents to see and hear from their child_ first-hand_ what he/she has learnt throughout the semester_ providing parents with an all-rounded view of the child's academic and character development. Such student-centric sessions allow the child to assume a more active role in his/her learning.",-1,-1
