school_name,url_address,address,postal_code,telephone_no,telephone_no_2,fax_no,fax_no_2,email_address,mrt_desc,bus_desc,principal_name,first_vp_name,second_vp_name,third_vp_name,fourth_vp_name,fifth_vp_name,sixth_vp_name,visionstatement_desc,missionstatement_desc,philosophy_culture_ethos,dgp_code,zone_code,cluster_code,type_code,nature_code,session_code,mainlevel_code,sap_ind,autonomous_ind,gifted_ind,ip_ind,mothertongue1_code,mothertongue2_code,mothertongue3_code,special_sdp_offered,grade_A,grade_O
CEDAR GIRLS' SECONDARY SCHOOL,http://www.cedargirlssec.moe.edu.sg,1 CEDAR AVENUE,349692,62884909,na,62820244,na,cedargirlss@moe.edu.sg,WOODLEIGH MRT_ POTONG PASIR MRT,8_ 61_ 64_ 65_ 66_ 90_ 100_ 135_ 151_ 154_ 155,MDM CHENG HWEE YEANG,MDM LIM YING YING,MDM TAN GEOK LAN,MDM JUSTINE TAN,na,na,na,Bringing out the Best in our People: Social Innovators_ Passionate Learners,Nurturing Leaders of Character,With the belief that every Cedarian can become a confident and active citizen_ Cedar is committed to providing a high quality all-round education. Beside a well-established 4-year O-Level programme_ Cedar also offers the Integrated Programme (IP) under the Victoria-Cedar Alliance (VCA). Our IP students will complete 4 years of secondary education in Cedar before advancing to Victoria Junior College for the A-level curriculum. The VCA IP offers a seamless 6-year programme to students who enjoy independent study and exploratory work. They will have the opportunities to heighten their interest and passion through a challenging and enriched curriculum. In our mission to develop Leaders of Character_ we have a comprehensive Character_ Citizenship and Leadership Development Programme which inculcates the values_ attributes and competencies desired of Cedarians in their journey through life. Cedar has received recognition in both the academic and co-curricular domains for its consistent performance and good teaching and learning processes. Graduating students each year have attributed their resilience to take on challenges_ confidence in striking out and motivation to always give of their best to the developmental programmes offered by the school.,TOA PAYOH,EAST,EAST 7,GOVERNMENT SCHOOL,GIRLS' SCHOOL,SINGLE SESSION,SECONDARY,No,Yes,No,Yes,Chinese,Malay,Tamil,Through the Leaders of Character Programme_ all Cedarians are given opportunities to put their values into action via student-initiated community projects so as to nurture and develop them into leaders of character. The Social Innovation Programme is the school's signature programme which aims to nurture Cedarians into social innovators. Through this programme_ students' innovative capacity is developed and honed to provide them with the vital skills they need to create breakthrough solutions to address authentic issues faced by the community. With the aim to broaden Cedarians' perspectives_ the Beyond Borders Programme provides Cedarians the opportunity to explore learning beyond the shores of Singapore_ see the world differently and learn to work collaboratively with local and international partners. Cedarians with special talents are given the opportunity to pursue their passions and interests through the Talent Development Programme. This programme aims to stimulate the students intellectually and cognitively to create new knowledge and stretch their potential.,-1,250
CHIJ PRIMARY (TOA PAYOH),http://www.chijpritoapayoh.moe.edu.sg,628 LORONG 1 TOA PAYOH,319765,63532164,na,63536362,na,CHIJTPPS@MOE.EDU.SG,Toa Payoh,59_ 231_ 141,MRS TAN SOON KEE MARGARET,MDM MISCHA LEIGH PEREIRA,MDM AUDREY KANG,na,na,na,na,A choice school providing the IJ legacy of a holistic education where girls become women of character_ women for others_ able to meet life's challenges with God as their Shepherd.,CHIJ Primary (Toa Payoh) believes in the creation of a Christ-centred school community where all work together for the promotion of truth_ justice_ freedom and love_ with special reference to the needs of the pupils who are disadvantaged in any way.,School Philosophy  Pupils will be provided with a vibrant IJ learning environment and a forward - looking curriculum that will develop their fullest potential - spiritually_ morally_ intellectually_ physically_ emotionally and socially.   School Culture and Ethos  Values-driven culture Culture of love and care Culture of collaborative learning Culture of self-determination and efficacy   Values - CHRIST values  Courage - To have the mental and moral strength to love and care for staff and pupils. Humility - To be humble to feedback readily for the common good. Respect - To honour people of diverse backgrounds & views_ care for their rights and treat others the way you would like to be treated.  Integrity - To have strong moral principles and acknowledge mistakes even when nobody is watching.   Steadfastness - To stay true to plans regardless of changes_ so as to achieve the desired goals.  Thoughtfulness - To care and consider others feelings and views before speaking_ doing and making decisions and have a propensity for anticipating their needs or wishes.   The desired attributes of an IJ girl:  - Self-Directed and Confident Learners  - Innovative Learners who pursue excellence  - Collaborative Learners who actively contribute  - Civic - Conscious and have a sense of national identity  - Service-oriented and have a passion to serve the school and community,TOA PAYOH,SOUTH,SOUTH 3,GOVERNMENT-AIDED SCH,GIRLS' SCHOOL,SINGLE SESSION,PRIMARY,No,No,No,No,Chinese,Malay,Tamil,Confidence - Building Programmes P1 and P2 - Dance and Gym P3 - Dance and Tennis P4 - Tennis P5 - Adventure Camp P6 - Rock Climbing  Lifeskills Programme  Spiritual Programmes Catholic formation Ethics Programme for non-Catholics Daily Morning Prayers Novena Sessions Lent Observances Mass Paraliturgies on Teachers' & Children's Day  Emotional Programmes IJ Wings Programme to build self-esteem in pupils. Buddy Programme to inculcate love and care between P2 and P1 Pupils.  Character Development IJ Values taught through: SEL Lessons_ Circle Time PAL Restorative Practices Pupils' Reflections Infusion into curriculum Infusion through reflections on Camps_ Overseas Trips & CCAs  Leadership @ IJ -Every Child a Leader - 7 Habits of Highly Effective People  IJ Leadership Training for Pupil Leaders Class EXCO installation and training Prefects' Training Camp Prefects' Investiture IJ Ambassadorship Programme  Specialised Programmes SAS Programme offering after-school supervision for selected pupils Support for pupils with learning disabilities by AED (LBS) Writers' Circle for talented writers (P5) Math Olympiad  Arts Curriculum Enrichment - Ballet & Fun Gym Post-Exam Arts Elective Programme Learning For Life Programme - Music and Performing Arts.  Other Programmes MT Overseas Immersion Programme  PE and CCA Platforms to Explore and Engage in PE and Sports P1/2   Sports Electives :  Fun Gym/Little Athletics/Tennis Bounce P1-3   Obstacle Course P3      Sports Electives :  Kidznet/Aquafun/Flippaball/P3 Swimming Programme P4      Outdoor Pursuits/T-ball/Nature Hike/ Forest Adventure Tree Top Challenge P5      Frisbee/Archery/Night Hike/Adventure Camp/Challenge Rope Course P6      Fun Tag Rugby/Sports Climbing  Excellence in Sports Niche areas for sports - Artistic Gym & Tennis Talent Management Programme Level Morning Moves  Excellence in Arts Niche areas of arts - Choir_ Handbells & Dance Annual IJ Arts Fest for P1 - P2 pupils Combined IJ Schools Choral Presentation,-1,-1
CRESCENT GIRLS' SCHOOL,http://www.crescent.edu.sg,357 TANGLIN ROAD,247961,64758711,na,64741248,na,CRESCENTGIRL@MOE.EDU.SG,REDHILL MRT,32_ 111_ 122_ 132_ 51_ 139_ 186_ 970,MRS HELEN CHONG,MDM V PRIYA RAJAN,MISS LOW SHIOK CHENG CINDY,MISS CHUANG SIEW CHIN,na,na,na,Ladies and Leaders of Tomorrow,We nurture Crescentians to be Confident Learners_ Global Citizens and Servant Leaders.,Crescent Girls' School provides a nurturing and innovative environment with a distinctive brand of education that empowers generations of students to grow into gracious and confident ladies_ and caring visionary leaders. The school focuses on transforming the learning experiences of students through pervasive and purposeful use of technology. As one of the pioneer FutureSchools@Singapore_ we continually harness technology to develop in our students a passion for learning and for life so that they are well-prepared for the challenges of the 21st century. Beyond academic excellence_ the school is committed to inculcating sound values in our students so that they are able to contribute to the community. There is a pervasive culture of care in the school_ and a strong emphasis on development of strength of character_ focusing on moral courage_ resilience_ empathy and commitment to teamwork to nurture our students to be responsible members of society and gracious citizens of the world. The school has done well in many aspects over the years. This is possible due to a team of dedicated and innovative staff and the support of parents_ alumnae and the school advisory committee.,BUKIT MERAH,SOUTH,SOUTH 2,GOVERNMENT SCHOOL,GIRLS' SCHOOL,SINGLE SESSION,SECONDARY,No,Yes,No,No,Chinese,Malay,Tamil,The school's Student Development Programmes are offered within our Student-centric Holistic Curriculum. In our Instructional Programmes_ students are exposed to a myriad of learner-centric teaching approaches that extend learning beyond the classroom and empower our students with 21st century competencies like collaboration_ global awareness_ skilled communication and real-world problem solving. Our 4-year Character & Leadership Development Programme provides all students with opportunities to develop their leadership potential. Our Values in Action Programme equips students with problem-solving skills and provides them with platforms to engage with the community_ with the aim of inspiring and empowering them to make a difference in society. All students have opportunities to travel overseas in our Service Learning Programme_ which aims to develop a sense of empathy_ civic responsibility and cross-cultural skills in our students. Our Talent Development Programme aims to stretch our able_ committed and creative students further. The school also offers the Music Elective Programme for students passionate about music.,-1,242
DAZHONG PRIMARY SCHOOL,http://www.dazhongpri.moe.edu.sg,35 BUKIT BATOK STREET 31,659441,65658002,na,65636421,na,dazhong_ps@moe.edu.sg,Bukit Gombak,187_ 188,MDM YAP SIU LIN,MISS SANTHANA MARY D/O POOBALAN,MR PHANG TECK HOW,MRS BOEY- LIM SEOW KHIM,MR KOH SEE CHOON,na,na,Achievers rooted in values_ soaring beyond limits,To nurture and inspire pupils to be self-directed learners_ gracious and resilient_ serving beyond self,Dazhong Primary School (DZPS) has a long history of almost 80 years. Anchored on our firm belief that every child can learn and give of one's best_ we strive to groom every student to serve beyond oneself and faces challenges with resilience.                                                                                                                                                                                                                                                                     A student-centric approach is adopted in designing our holistic curriculum to help every student live out our school's values of 'IREAP': 'Integrity_ Responsibility_ Excellence_ Acceptance and Perseverance'. Our six-year structured curriculum through our LLP-Arts Education programme offers a myriad of learning experiences which help to cultivate in every student_ 'Howard Gardner's 5 Minds for The Future' - The Disciplinary Mind_ The Synthesizing Mind_ The Creating Mind_ The Respectful Mind & The Ethical Mind'.  This prepares them to be self-directed learners_ gracious and resilient citizens who seek to serve beyond self for the future.                                                                                                                                                                                       Coupled with a warm and caring environment afforded by a team of committed staff_ we believe that our students can become 'Achievers rooted in values_ soaring beyond limits'.,BUKIT BATOK,WEST,WEST 4,GOVERNMENT SCHOOL,CO-ED SCHOOL,SINGLE SESSION,PRIMARY,No,No,No,No,Chinese,Malay,Tamil,Learning for Life Programme (LLP):  Developing 21st century competencies through Arts Education Programme@Dazhong (AEP@DZPS). Our signature programme aims to develop our students to be future ready. We are also the only primary school in Singapore to have a Junior Orchestra Talent development programme supported by the MOE Arts Education Branch.  Character & Citizenship Development:  Resilience@DZPS via Outdoor Education Programme (OEP) aims to build resilience and 'gritty' children through a longitudinal OEP_ where students undergo rugged and authentic learning experiences to develop character_ strength and tenacity. Other Character Development programmes include 'myCEED@DZPS - Character and Citizenship Programme_ NE Current Buzz_ Gratitude Journalling & Servant Leadership Development Programme through iLEAD (Leadership Experience at Dazhong).  Cognitive (Critical & Inventive Thinking Development):  Beyond supporting the students' development in Literacy and Numeracy. Students are exposed to other stretch programmes such as Fun with Coding Programme to develop Computational Thinking Skills_ Science Learning through the  I- Experience programme_ Literacy programmes such as Writing With Purpose & the Math Mastery Programme.,-1,-1
DUNMAN HIGH SCHOOL,http://www.dunmanhigh.moe.edu.sg,10 TANJONG RHU ROAD,436895,63450533,na,63442316,na,DHS@MOE.EDU.SG,ALJUNIED MRT_ KALLANG MRT_ MOUNTBATTEN MRT,12_ 14_ 30_ 158_ 196,MR LOW TECK ENG TONY,MDM TEY KAH HWEE,MR KEITH TAN,MISS LIE SUYIN JAMIE,MISS SEE PEI LOO,na,na,The Premier School of Leaders of Honour,To Nurture Our Students to Care_ to Serve_ and to Lead,In Dunman High School_ we view the twin pillars of a rigorous curriculum and character development as fundamental to the education of our students. This educational ethos is influenced by Confucian philosophy_ where the Head_ Heart and Hands are important in developing all-round individuals and knowledgeable Leaders of Honour with a heart to care for and serve others within and beyond the school community.,KALLANG,EAST,EAST 4,GOVERNMENT SCHOOL,CO-ED SCHOOL,SINGLE SESSION,MIXED LEVEL,Yes,Yes,Yes,Yes,Chinese,na,na,Established in 1956_ Dunman High School has distinguished itself as a Special Assistance Plan (SAP) school (1979) and is among the pioneer batch of schools to be accorded the Autonomous Status in 1994. The school now offers a 6-year Integrated Programme with expanded opportunities in School-based Gifted Education_ Music Elective Programme_ Bicultural Studies Programme_ Chinese Language Elective Programme_ Talent Development Programme_ Malay Special Programme_ Thinking & Research Skills Programme_ Overseas Immersion and Student Leadership Development Programme.,9,256
EUNOIA JUNIOR COLLEGE,http://www.eunoiajc.moe.edu.sg,53 MOUNT SINAI ROAD,276880,63518388,na,63518399,na,eunoiajc@moe.edu.sg,Buona Vista MRT Station_ Dover MRT Station,92_ 100_ 105_ 106_ 111_ 147_ 185,MDM CHEANG MEI HENG,MR POH CHUN LECK,MR TAY JUNCHENG ADRIAN,MR MOHAMAD AMRAN SHAH BIN ABD RAHIM,na,na,na,Every Eunoian a Youth with Purpose_ Thinker with Heart_ Leader with Courage,We Enable students to learn continuously_ Empower students to seek all-round excellence_ and Embolden students to pursue their purpose.,na,BISHAN,NORTH,NORTH 1,GOVERNMENT SCHOOL,CO-ED SCHOOL,FULL DAY,JUNIOR COLLEGE,No,No,No,Yes,Chinese,Malay,Tamil,Environmental Literacy Programme Leadership Advancement Programme Liberal Arts Programme Life Coaching Programme Passion Pursuit STEM Research Programme Talent Development Programme World Readiness Programme,9,-1
EVERGREEN SECONDARY SCHOOL,http://www.evergreensec.moe.edu.sg,11 WOODLANDS STREET 83,738489,63656392,na,63658083,na,EVERGREEN_SS@MOE.EDU.SG,WOODLANDS MRT,911,MR TOH KIM YONG VINCENT,MR ELANGOVAN S/O V MUTHOO,MR CHUA TUNG KIAN,na,na,na,na,A dynamic school that thinks and cares.,We nurture citizens of character with the passion to contribute and excel.,Evergreen Secondary School is guided by our Vision_ Mission and Values to nurture our students to become Caring Leaders and Thinking Citizens. We believe every student who aspires to do well can succeed if given the right support from teachers and parents. Thus we recognise the importance of forging effective partnerships with our parents in addition to building a team of dedicated and competent teachers. In preparing our students for the challenges of the 21st Century_ we believe it is of utmost importance to design a forward-looking curriculum undergirded by sound values. Hence_ in our school_ we adopt a school-wide approach in which character and citizenship education is integrated into all instructional programmes and CCA programmes.,WOODLANDS,NORTH,NORTH 5,GOVERNMENT SCHOOL,CO-ED SCHOOL,SINGLE SESSION,SECONDARY,No,No,No,No,Chinese,Malay,Tamil,The school's Applied Learning Programme aims to develop Effective Communicators_ Caring Leaders and Inventive Thinkers through a 3-year Communication Skills Programme. Through this programme_ students develop deep analytical and critical thinking skills_ collaborative skills and oratorical skills through Effective Reading_ Debates and Presentations. Talent development programmes such as the Model United Nations_ e-Journalism and the Odyssey of the Mind Competition_ allow students to further hone their interest. The school's Learning for Life Programme (LLP) is a 4/5-year programme that focuses on Strengthening Resilience_ Character and Leadership through Sports Education. With this programme_ the school aims to nurture all students to become thinking and caring leaders who take personal responsibility for maintaining an active and healthy lifestyle. Students will be exposed to a broad-based PE curriculum and authentic applications of lessons on resilience and leadership through outdoor programmes_ CCA and partnerships with external agencies. To nurture community engagement_ the school has a comprehensive Sec 1-4 Service Learning structure. This approach empowers students to participate in learning experiences that are tailored to levels to internalise values_ sharpen leadership skills and develop critical thinking competencies. The school also offers a structured Science and Technology Research Programme (STRP) to stretch the potential of our students_ by providing them with opportunities to work on research projects under the guidance of dedicated teachers. This equips them with research skills_ analytical skills and presentation skills.,-1,227
FAJAR SECONDARY SCHOOL,http://www.fajarsec.moe.edu.sg,31 GANGSA ROAD,678972,67691491,na,67633025,na,FAJAR_SS@MOE.EDU.SG,BUKIT PANJANG MRT_ BUKIT PANJANG LRT_ PETIR LRT,67_ 75_ 170_ 171_ 176_ 177_ 178_ 180_ 960_ 961_ 961C_ 963_ 963E_ 963R_ 970_ 979_ 979M,MISS HO SOOK FUN DORIS,MRS ROSIE LAU @ MDM ROSIE LIM,MS CHOO WAN XIAN,na,na,na,na,A Vibrant Community of Learners who Lead and Contribute to Family_ Nation and Beyond.,To Grow a Vibrant Community of Leader-Learners of Character who Contribute to Family_ Nation and Beyond.,We strive to develop all our students to be learning leaders firmly anchored in sound moral values through a student-centric_ values-driven education within a holistic learning environment.  These values are infused into the academic curriculum_ the Applied Learning Programme (ALP)_ the Learning for Life Programme (LLP) and the Character and Citizenship Education (CCE) curriculum. Our team of committed staff build strong teacher-student relationships and trust as we nurture our students in developing sound character to give their best to realize their dreams with courage_ to succeed in life and contribute to the school_ nation and beyond.,BUKIT PANJANG,WEST,WEST 8,GOVERNMENT SCHOOL,CO-ED SCHOOL,SINGLE SESSION,SECONDARY,No,No,No,No,Chinese,Malay,Tamil,The school is committed to equipping our students with the necessary 21st Century Competencies (21CC) for the future via our CCE curriculum_ Values In Action programmes including Service Learning_ a vibrant CCA programme_ Creative Arts Programme_ Leadership opportunities_ Applied Learning (ALP) and Learning for Life (LLP) Programmes. Our ALP on 'Sustainability' seeks to enable our students to attain the relevant knowledge_ in particular_ the Scientific Thinking and Engineering Design approaches. We also seek to develop 21CC in our students_ especially Applied Critical and Inventive Thinking Skills (ACIT)_ values and attitudes to enable them to contribute positively and effectively to a sustainable 21st century world. Our ALP makes relevant the knowledge in our classrooms to our students' daily life experiences via authentic learning tasks_ and enables our students to learn the process skills of design thinking_ problem-based learning_ and inquiry-based learning. The school is committed to bringing out the leadership potential in every student through our Student Leadership Programme (our LLP). This programme aims to build in our students the necessary 21st century skills_ core values_ and social and emotional competencies to face the challenges of the future. Our 'Educate-Encourage-Empower' framework and whole school involvement ensure an integrated and systematic student leadership development effort. Every student is 'educated' with an enhanced awareness of leading self and others_ as well as relevant life-skills_ and student leaders are given additional training to perform their roles and responsibilities well. Recognition structures are in place to 'encourage' development and personal mastery of leadership skills. Our students are also 'empowered' to undertake self- and class-initiated projects_ to organise student-led programmes_ and to give feedback and take action for school improvement.,-1,188
FRONTIER PRIMARY SCHOOL,http://www.frontierpri.moe.edu.sg,20 JURONG WEST STREET 61,648200,65789555,na,67908596,na,frontier_ps@moe.edu.sg,Pioneer MRT Station (EW28),241,MDM LEE YEW KOON TONNINE,MR SYAMSUL ANWAR BIN AWANG,MDM CHAN YEE CHIN WILNA,MR GOH GIN HOWE,na,na,na,Confident Thinkers. Adaptable Learners.Passionate Leaders.,We develop every Frontierer to reflect deeply_ embrace differences and serve as a role model to overcome future challenges.,We are guided by our philosophy of 'Strong Fundamentals_ Future Learning' which underpins the holistic education that Frontier provides to prepare our pupils to thrive in a fast-changing and highly-connected world. We want our pupils to be grounded with strong fundamentals so that they can partake in future learning.  At Frontier_ we believe that pupils are at the centre of all that we do. We want to nurture our pupils to grow up to be confident thinkers_ adaptable individuals and passionate leaders in the 21st century. We strive to provide holistic education to all our pupils through exciting_ engaging and enriching learning experiences. We care about the socio-emotional learning of our pupils so that they care for themselves and others. We keep ourselves abreast of effective teaching and learning strategies and pedagogies through reflective practices and collaboration. Staff also grow ourselves so that we are always able to give our best to our pupils.   Teaching and learning in the school will be deep and mindful. Good learning is not always speedy; it is reflective. We want our pupils to be able to reflect_ to discover and even to slow down at times and exercise metacognition. In this way_ creativity in pupils and breakthroughs can be fostered and learning deepened.,JURONG WEST,WEST,WEST 3,GOVERNMENT SCHOOL,CO-ED SCHOOL,SINGLE SESSION,PRIMARY,No,No,No,No,Chinese,Malay,Tamil,The school has 5 Key Programmes to achieve our vision for Frontierers:  Frontier's Approach to Communicating Effectively (F@CE) aims to develop our pupils to have effective communication and critical thinking skills_ so that they can articulate their knowledge_ ideas and thinking clearly and confidently while displaying school values.  Thinking Silhouette is a customised thinking model that helps the school realise our vision of developing our pupils into 'Confident Thinkers'. Each thinking silhouette is a profile of one facet of a person's thinking.   Restorative Practices is the school's approach to inculcate a culture of care and restorative relationships in the school. Frontierers will understand the importance of making responsible personal choices that positively affect their relationships. They are also taught to understand that they have the power to contribute towards building a positive environment.  danceFRONT is the school's approach to deliver Dance and Performing Arts education to Frontierers. The school believes that dance and performing arts develop self-esteem and confidence of participants_ as well as self-management from the listening and concentration required during the activity.  exemplary Leaders@Frontier (eLF) aims to harness the leadership potential and develop the leadership skills in every child by providing each with relevant opportunities and training. The core beliefs of eLF are that leadership can be taught and learned_ is a developmental process_ is a collective activity_ and is rooted in service.,-1,-1
