school_name,url_address,address,postal_code,telephone_no,telephone_no_2,fax_no,fax_no_2,email_address,mrt_desc,bus_desc,principal_name,first_vp_name,second_vp_name,third_vp_name,fourth_vp_name,fifth_vp_name,sixth_vp_name,visionstatement_desc,missionstatement_desc,philosophy_culture_ethos,dgp_code,zone_code,cluster_code,type_code,nature_code,session_code,mainlevel_code,sap_ind,autonomous_ind,gifted_ind,ip_ind,mothertongue1_code,mothertongue2_code,mothertongue3_code,special_sdp_offered,grade_A,grade_O
TANJONG KATONG PRIMARY SCHOOL,http://www.tanjongkatongpri.moe.edu.sg/,860 NEW UPPER CHANGI ROAD,467353,63444728,na,63445370,na,TKPS@MOE.EDU.SG,From Bedok MRT: 2_ 9_ 24_ 31_ 35_ 35M_ 222 From Tenah Merah MRT: 2_ 9_ 24_ 31_ 35_ 35M_ 45,New Upper Changi Road (Opposite the school): 2_ 9_ 24_ 31_ 35_ 35M_ 45_ 222_ 506_ NR7 (School side): 2_ 9_ 24_ 31_ 35_ 35M_ 45_ 222_ 506,MRS CAROLINE WU,MDM HOO WAI LING,MRS VIJAYA GANESH,na,na,na,na,To nurture pupils so that they can excel in their pursuits and contribute to the society_ through providing a holistic education and a dynamic learning environment.,Passionate Learners_Caring Leaders_ Global Citizens,Tanjong Katong Primary started in 2001 as an amalgamation of 3 schools_ Fowlie Primary(a result of an earlier merger between Fowlie and Seraya Schools)_ Haig Boys' and Mountbatten Primary Schools. In its earlier years_ Tanjong Katong Primary was well-known for its higher proportion of international students. Even up till today_ the school continues to boast of a student population that comes from diverse backgrounds in terms of their nationality and ethnicity. Since TKP opened its doors_ it has made a name for itself with the all-round_ balanced education it provides as well as the caring culture within the TKP community.  In TKP_ we believe that every child is different and each comes with his/her unique talents and needs. As such_ we are committed to nurturing each of them to fulfil his/her potential. We hope that through providing a holistic education that develop our students in the various domains_ they will have opportunities to discover their strengths. We also hope that they would also be exposed to ways in which they can use what they have learnt to benefit others.  Our new vision_ 'Passionate Learners_ Caring Leaders_ Global Citizens'_ is an expression of aspiration for our students so that they will be prepared and equipped for the VUCA world and the future ahead.  We strive to provide a dynamic learning environment so that our students may develop a love of learning_ not just learning during their schooling years but into their life_ long after they have left school. We nurture them so that they could excel in their pursuits. When they succeed in life_ we hope that they would have empathy and care about others; and contribute back to the society. We would also like to continue to tap on the unique profile of the students to cultivate the cross-cultural skills essential for them to thrive in a globalised world.  To this cause_ we will work with our partners_ including parents_ alumni and the community_ to enrich the learning experiences of our students.,MARINE PARADE,EAST,EAST 5,GOVERNMENT SCHOOL,CO-ED SCHOOL,DOUBLE SESSION,PRIMARY,No,No,No,No,Chinese,Malay,Tamil,3i Approach  TKP has designed a balanced curriculum that nurtures different interests_ abilities and talents based on the 3i approach_ namely instruction_ interaction and inquiry. Therefore_ our teachers are committed to: 1) design and customise curriculum content and its accompanying pedagogical approaches and strategies in explicit instruction_ 2) use strategies (e.g. STELLAR_ PERI-HA_ MTV) and leverage on programmes (e.g. Learning Carnivals_ Learning Journeys and MTL Fortnight) to establish a tone of learning environment for positive  interaction_ and 3) to develop higher-order thinking through inquiry-based teaching and learning in various subjects_ Project Work_ and ICT integration in all academic subjects to achieve active inquiry.  Lifelong Learning Programme: Team Sports Excellence@TKP As part of our school's strong tradition in sports and our belief in values inculcation and learning of socio-emotional competencies_ our school has developed Team Sports Excellence@TKP programme. A two-pronged approach is used for this programme: 1) the Active Lifestyle Programme targeted at all pupils_ and 2) the Sports Pursuit Programme for talent development. Four team sports (football_ netball_ hockey and floorball) have been identified to further develop talent and interest in our students_ and to provide opportunities for their pursuit of excellence.   Heritage Programmes In order to instil a sense of belonging and rootedness to the school and the community we live in_ heritage programmes which tapped on the history of the school as well as the rich heritage and culture of Katong have been developed. The TKP Heritage Gallery has been set up to educate our students on the history of Katong and the school. Interactive trails around Katong using mobile devices designed by our students were also developed. Since their inception_ our students have gone on these i-trails as part of the Social Studies curriculum.,-1,-1
TECK WHYE PRIMARY SCHOOL,http://www.teckwhyepri.moe.edu.sg,11 TECK WHYE WALK,688261,67691025,na,67635191,na,twps@moe.edu.sg,Chua Chu Kang MRT & LRTs,975_ 190 & 985,MISS WONG LIANG- JI TABITHA,MDM TAN WAN PHING JANICE,MR MURALIDHARAN S/O NARAYANAN,na,na,na,na,A future-ready community of passionate learners  anchored in values and striving for excellence to make a positive difference.,Inspiring and empowering our learners to be their best for self and others through a supportive environment and innovative & effective teaching-learning practices.,At Teck Whye Primary_ we believe that all children can learn and want to learn and that teaching needs to cater to different progress levels and be anchored on meaningful engagement. Every child can be inspired and empowered to achieve within a supportive environment anchored on safety and care. Teachers_ as role models_ impart sound values_ build character and inspire their students to learn by building quality relationships with and among students. To meet future challenges_ our students must extend their learning beyond the acquisition of knowledge and skills_ and apply and use their learning in meaningful ways.  Established since 1959_ Teck Whye Primary envisions our learners to achieve the following outcomes and exercise the related values in their daily lives:   Confident Communicators who Engage with Respect   Healthy Individuals who eXercise Responsibility   Adaptive Leaders who Collaborate with Integrity   Model Citizens who Encourage through Compassion   Passionate Learners who Learn with Resilience The rallying call is for CHAMPs who embrace and strive for the value of Excellence.  To realise these outcomes_ the school provides a strong grounding in the various subjects while placing emphasis on the (i) acquisition of 21st century competencies_ (ii) development of effective communication skills and an understanding of media use and production_ (iii) inculcation of values and social emotional development_ (iv) understanding of the importance of National Education and (v) development of leadership competencies.  The school_ therefore_ whilst encouraging our students to do well academically_ also places a very strong emphasis on character and holistic development. We believe that this would provide a firm foundation for our students as they pursue their secondary education but more importantly as they live their lives.,CHOA CHU KANG,WEST,WEST 5,GOVERNMENT SCHOOL,CO-ED SCHOOL,SINGLE SESSION,PRIMARY,No,No,No,No,Chinese,Malay,Tamil,Teck Whye Primary's Applied Learning Programme (ALP) is entitled 'Media Whiz Kids!'_ a media and media literacy-based programme. The programme aims to enable our students to apply the knowledge and skills acquired in Languages_ Technology_ Art and Music to authentic and meaningful contexts.  Specialised media programmes will support those with talents and a keen interest through our various CCAs such as the Infocomm Club_ iDesign Club_ and Speech and Drama Club. The ALP is intended to develop confident students who can put across their thoughts and ideas verbally and in written form in both digital and non-digital platforms_ and are able to harness relevant tools and media to enhance communication. Programming to promote computational thinking will also be introduced to students as part of this ALP.  Our Learning for Life Programme (LLP)_ entitled 'I Lead_ I Serve'_ is a leadership development programme which adapts Kouzes and Posner's five practices of exemplary leadership to guide the development of leadership competencies. Stories will be used as a primary means to raise awareness of leadership skills and dilemmas. The programme is centred on a core belief that leadership is about service to others and students will be involved in a range of learning experiences which will vary in complexity depending on their ages and leadership roles.  The school's CHAMP programme emphasises the development of character and students will have the opportunity to reflect and act on the school values. Parents are also encouraged to be involved as part of this programme.  Our students also undergo a variety of other special programmes as part of the school curriculum. These include structured Arts development from P1-6 where they will learn about musical instruments such as the Ukulele and digital keyboards_ and art forms such as Manga_ Chinese Painting and Batik Painting. Sports programmes such as Tennis_ Archery and Bowling are also provided to broaden our students' experiences.,-1,-1
TEMASEK JUNIOR COLLEGE,http://temasekjc.moe.edu.sg,22 BEDOK SOUTH ROAD,469278,64428066,na,64428762,na,TEMASEK_JC@MOE.EDU.SG,BEDOK MRT,12_ 16_ 31_ 38_ 47_ 137_ 155_ 196_ 197_ 229,MDM SIM AY NAR,MDM TAN KIA HUAN,MR FOO YONG HOWE,MR MARK CHAN,na,na,na,An Institute of Distinction_ A Dynamic Learning Culture_  A Caring TJC Family,Broaden Minds_ Touch Hearts_ Enrich Lives,Every TJCian is nurtured to be a trailblazer with a heart. Mindful of tradition_ roused by imagination and fuelled by ambition_ TJCians are active learners_ caring and committed citizens and ethical leaders. Our holistic brand of Temasek Excellence equips students with intellectual_ moral and social capital to thrive in a  fast-changing and complex world. The college achieved the School Distinction Award in 2015_ with Best Practices for Teaching & Learning_ Student All-Round Development_ Staff Well-being and Development_ Character and Citizenship Education as well as Partnership. Our dynamic staff fraternity continuously innovate and hone our craft_ as we guide our students to bring out the best in them. The motto we proudly serve is 'For College_ For Nation'.,BEDOK,EAST,EAST 2,GOVERNMENT SCHOOL,CO-ED SCHOOL,FULL DAY,MIXED LEVEL,No,No,No,Yes,Chinese,Malay,Tamil,The TJC 6-Year Integrated Programme provides a seamless progression of learning_ empowering students beyond the basics by exposing them to both breadth and depth of knowledge_ leading up to the GCE A-Level Examination in Year 6. The design of the 6-year IP curriculum supports integrative and interdisciplinary learning_ extending 'Beyond Basics' through the core curriculum_ 'Beyond Boundaries' through extended learning and 'Beyond Self' through student development. It aims at achieving 'Temasek Excellence'_ engendering in students greatness in intellect_ character and leadership. IP students have a plethora of programmes to whet their appetites. Beginning from IP1_ the Temasek Academy Unbound Programme develops talented students in areas of Mathematics_ Sciences and English. Students participate in a variety of workshops_ talks and seminars conducted by experts in relevant fields. Moreover_ there are signature IP programmes such as those for special talent areas (academic_ aesthetics_ sports)_ World without Borders_ Wonder.Observe.Weave! attachment to external organisations_ ACE CCE Programme and Temasek Leadership Showdown.  In addition_ there are Elective Programmes - Music Elective Programme (Year 1 to 6)_ Chinese Language Elective Programme (Year 3 to 6) and Humanities Programme (Year 3 to 6) - which lead outstanding students to the MOE Scholarships at Year 5.,9,249
UNITY PRIMARY SCHOOL,http://www.unitypri.moe.edu.sg,21 CHOA CHU KANG CRESCENT,688268,67676750,na,67676751,na,UNITY_PS@MOE.EDU.SG,Yew Tee MRT,TIBs 302,na,MDM KOH SIEW CHENG,MR KOH PENG YEOW,MDM LEE SUET FONG,MDM CHUA LENG LENG (CAI LINGLING),na,na,Creative Minds_ Caring Hearts,We shall nurture our pupils to be responsible individuals of integrity who respect others and have a passion for learning.,We anchor our beliefs on growing the school 'from good to great' and structure our school processes through the UPS School Management Model which reflects the four principles of Quality Relationships_ Building Capacity_ Effective Leadership and Effective Systems. Guided by our philosophy of 'Everyone Matters'_ we strive to provide all students with our very own Unity experience_ where we believe that all children can learn and are committed to achieving success.  Our commitment is to ensure that quality teaching and learning are the focus both in and out of classrooms. Through our CORE values of IC2R (Integrity_ Courage_ Respect and Responsibility)_ we guide our students to develop the foundations for lifelong learning_ and also provide an educational experience that is both student centric and values driven. Over the years_ our students have done well and their success is due to the hard work of a nurturing team of dedicated teachers and supportive parents.   Teamwork amongst staff is also our strength and it defines our work at Unity Primary. We have a strong team in place and with a shared commitment_ we continue to make great things possible for all our students. Our belief that Everyone Matters is our cornerstone and this experience will be wholesome_ enriching and joyful_ whereby we seek to nurture every student and staff to achieve our vision of Creative Minds_ Caring Hearts.,CHOA CHU KANG,WEST,WEST 2,GOVERNMENT SCHOOL,CO-ED SCHOOL,SINGLE SESSION,PRIMARY,No,No,No,No,Chinese,Malay,na,"We believe that academic pursuits and character building are complementary in nature and equally important in the holistic development of our students.  Our Applied Learning Programme (ALP)_ CAPtivate -Critical thinking Accelerated Programme @ UPS aims to promote reading_ address linguistic fluency and comprehension. Elements of critical thinking are also infused in R.A.B.B.I.T (Read A Book Because It's Terrific)_ which is an important component of the programme.  The school is committed to promoting engaged learning and sound character development of our students. Our Learning for Life Programme (LLP) ""CharGE UP!' -(Character development through Green and Experiential learning @ Unity Primary) is designed with these in mind. Our I-Character programme is merged with Green@UPS_ which is our environment initiative. This encapsulates our CCE efforts and they are the key drivers for the character development of our students.  We believe that learning beyond the classroom is important and opportunities are provided to our students to experience outdoor and overseas learning journeys. P4 students begin their outdoor education through the Adventure Camp at MOE Adventure Centres. The objectives of the camp experience are to foster in them resilience_ ruggedness and a can-do spirit in challenging learning environments. Continuing the experience in P5_ they participate in an overseas Learning Journey to Malaysia. This trip serves to inculcate values of team work_ responsibility and a sense of independence with the focus on NE messages and citizenry. In P6_ the learning continues with a 3-day camp with the focus on motivation_ study skills and personal responsibility.  We have also incorporated CCA within curriculum time for all P3 to P6 students and at the heart of the Co-Curricular Programme is the development of values and character which is reinforced via circle time. All students belong to a CCA_ reflecting our emphasis on CCAs as an integral part of holistic education.",-1,-1
VICTORIA JUNIOR COLLEGE,http://www.victoriajc.moe.edu.sg/,20 MARINE VISTA,449035,64485011,na,64438337,na,victoria_jc@moe.edu.sg,Nearest MRT Stations:  Kembangan_ Eunos,13_ 16_ 31_ 36_ 43_ 48_ 55_ 135_ 196_ 196e_ 197,MISS EK SOO BEN,MR GURUSHARAN SINGH S/O M SINGH,MR CHEONG TIEN BENG,MR HONG HENG YAN,na,na,na,LiVE like a Victorian - Legendary Spirit - Visionary Leadership - Extraordinary Service,To ignite the imagination of all Victorians to create the future with conviction_ courage and compassion,na,BEDOK,EAST,EAST 7,GOVERNMENT SCHOOL,CO-ED SCHOOL,FULL DAY,JUNIOR COLLEGE,No,No,No,Yes,Chinese,Malay,Tamil,Arts Programme  Beyond Borders Programme Higher Education Guidance Programme Olympiad Training Programme Overseas Exchange Programme Scholarship and Mentoring Programme Victoria Science Research Talent Development Programme  Student Leadership Programme   Career Guidance and Work Attachment,6,-1
WELLINGTON PRIMARY SCHOOL,http://www.wellingtonpri.moe.edu.sg,10 WELLINGTON CIRCLE,757702,67533319,na,67533765,na,WELLINGTONPS@MOE.EDU.SG,Sembawang MRT,980_ 856_ 859,MR ALCANTARA ALBERT ALFRED,MDM KONG YEE LOON,MR NG WEE MING DENNIS,na,na,na,na,Becoming a global STAGE to grow World-ready Talents & People.,To empower every individual_ nurture talents and groom leaders.,"We believe in developing a Gem in every Wellingtonian. Each Gem has unique qualities that can sparkle under any light source.  Hence we dedicate ourselves to provide a global stage for our Gems so that they can practise what we call ""Learning by doing_ doing until we become"". We believe that each unique Gem can be shaped and nurtured to excel in character through the experiential approach to learning. Character is shaped through habitual practices of right values.  As a Wellington Gem_ each child will take initiative to act to meet the needs of the world around them. This is why we define leadership as 'taking the initiative to make a difference to the people around us!' Our aim is that by the time each Gem leaves Wellington Primary_ he or she would have left a positive mark somewhere in Sembawang_ in Singapore or the world.",SEMBAWANG,NORTH,NORTH 7,GOVERNMENT SCHOOL,CO-ED SCHOOL,SINGLE SESSION,PRIMARY,No,No,No,No,Chinese,Malay,Tamil,Student Leadership Programmes (including Student Ambassador Programme & Student Council);Lifelong Learning Programme in Dance / Aesthetics; Advanced Programmes for Excellence (APEX) in Languages & Math+Sciences; ALP in New Media & Technology including eGame Making,-1,-1
WEST VIEW PRIMARY SCHOOL,http://www.westviewpri.moe.edu.sg,31 SENJA ROAD,677742,67600178,na,67600147,na,wvps@moe.edu.sg,CCK MRT_ SENJA LRT (A13),170_171_176_178_180,MR FOO CHIT CHEONG EDDIE,MR QUEK SWEE NEE,MDM LAI SEOW POH,MISS PATRICIA CHONG HUAY LENG,na,na,na,Passionate Learners_ Confident Leaders,A vibrant school where we strive to do our best,School Philosophy Every West Viewan_ A Talented Pupil  School Motto Aim High  Values I-CARE Integrity to uphold   Commitment to learning  Aspiration to achieve Responsibility_ our personal growth Excellence_ our pursuit,BUKIT PANJANG,WEST,WEST 5,GOVERNMENT SCHOOL,CO-ED SCHOOL,SINGLE SESSION,PRIMARY,No,No,No,No,Chinese,Malay,Tamil,STRIVE@WVPS is a signature programme designed for our primary 3 to 6 pupils. It is a school-based modular CCA programme for P3 to P6. It aims to make schooling an exciting and enjoyable experience for pupils. It focuses on real-life experimental learning to develop pupils' character and values. It serves to broaden pupils' learning in authentic settings that can further challenge them to grow and develop. As pupils enjoy learning_ they will be motivated and poised to strive for excellence cognitively_ aesthetically_ physically and socio-emotionally.   The Da Vinci Programme is specially customised for high-achieving learners from P3 to P6 classes. Its main objectives are to develop pupils' intellectual depth and promote higher-order thinking skills. The school sees the importance of developing programmes that cater to the individual needs and abilities of pupils. These pupils who have the potential and ability must be maximised to stretch and achieve their highest level.  As such_ these pupils are given an enriched curriculum that is pitched to challenge and stretch them. This enriched curriculum is built on the regular curriculum.  In this school_ we believe that every child has potential and is an agent of change; every West Viewan is a Leader. Hence_ we sensitise our pupils as caring individuals to the developments taking place around them and educate them for the future through The Leader In Me programme. Content from The 7 Habits of Highly Effective People forms that key component of the overall student learning and development process in the school. It reminds our pupils to embrace personal responsibility to become good in their endeavour. It requires them to understand the importance of learning and gaining knowledge for personal growth_ having a growth mindset and commitment to learning. They take pride in who they are and what they can achieve on their own and with others.,-1,-1
WESTWOOD PRIMARY SCHOOL,http://www.westwoodpri.moe.edu.sg,1 JURONG WEST STREET 73,649188,64121690,na,67945084,na,westwood_ps@moe.edu.sg,Boon Lay MRT Station,181_ 502 & 243,MR NG YEOW LING,MS TRACY TAN I- LIAN,MRS RUTH TAI MEI FEN,MR CHIN HONG FAI HUMPHREY,na,na,na,A positive institution in Jurong West that inspires the community to lead meaningful and engaged lives,To provide positive education that nurtures thriving teachers and flourishing pupils,Westwood Primary was founded in 2013_ premised on the core philosophy of Positive Education.  Our overarching goal is for our staff and pupils to strive for both excellence and wellbeing_ and for our school community to thrive and flourish.  Learning is delivered with positive engagement so as to invite every pupil on a journey of discovery and holistic development.  Discipline is promoted in a respectful way to engender self-reflection and growth.  By emphasising positive motivation and affirmative attitudes_ we nurture an awareness of greatness and potential in each and every staff and pupil_ as they set personalised goals and ultimately demonstrate creative expression_ problem-solving_ and meaningful achievement.    In keeping with the philosophy of Positive Education_ Westwood Primary's Staff Belief is that Every One is a Talented and Unique Individual with Potential for Success. Our Westwood School Culture is one of care_ love and drive_ and we aspire in going the extra mile in everything we do.  To enable all staff and pupils to believe that he or she can be an agent of change_ with opportunities to use his or her talents and skills to benefit others_ our positive school culture is grounded in our core values of A Heart of Gratitude_ A Resilient Mindset_ A Passion for Community and A Future-Ready Confidence.  A THRIVE Framework for Positive Education has been developed to ensure that school policies_ practices and programmes are aligned to the six key domains of positive accomplishment (Thinking mindfully); positive health (Healthy coping); positive relationship (Relating well); positive engagement (In the moment); positive meaning (Values-driven actions); and positive emotions (Emotions of positivity).  To this end_ we actively partner parents and the wider community_ seeking opportunities to contribute to community life_ while living out the message of positivity_ hope and well-being.,JURONG WEST,WEST,WEST 8,GOVERNMENT SCHOOL,CO-ED SCHOOL,SINGLE SESSION,PRIMARY,No,No,No,No,Chinese,Malay,na,Aligned with positive education_ our student development programmes serve to develop our pupils' resilience and  promote an understanding of his or her own strengths.  We also focus on optimism and on the importance of doing social good.  Accordingly_ our signature school programmes are as follows:   Applied Learning Programme (Positive Design & Innovation):  With inter-disciplinary project work as a platform_ pupils learn about the principles of positive design and thinking protocols_ and explore how their ideas and observations can be turned into useful designs and solutions that benefit their peers and their community.   Learning for Life Programme (Student Leadership & Community Service): Throughout their time in Westwood Primary_ every child is given an opportunity for leadership_ and comprehensive training and mentoring is provided to support each child is their leadership journey. Westwoodians are also given many opportunities to give back to their community via class-wide and level-wide programmes.   Holistic Learning_ Assessment and Reporting: Westwood Primary has adopted a whole-school approach towards holistic assessment_ aligning PERI-HA practices with its founding philosophy of Positive Education. Formative Assessment (FA) practices are adopted in all classrooms_ so as to promote learner engagement and ensure every child has a voice. Positive questioning and process praise help children to focus on the process of learning.  Westwood Primary also engages parents in Holistic Assessment_ via the annual Teacher-Parent-Pupil Conference_ where pupils share what and how they have learnt with their parents_ prompting authentic discussions that involve each child in personalised learning.   Programme for Active Learning (PAL) for Lower Primary Pupils:  Our PAL Framework is guided by VIP principles_ with the programme being Values-Driven_ Incorporating Innovative Learning and being Positive-Education-focused.,-1,-1
